{
  "schema_version": 1,
  "run_id": "pilot-synthetic-debug-001",
  "pilot_track": "debug",
  "source_type": "synthetic",
  "work_item_id": "WI-SYN-001",
  "task_type": "defect_debugging",
  "workflow_mode": "diagnostic_chain",
  "human_owner": "fixture-owner",
  "repo_root": "/workspace/example",
  "base_commit": "0123456789abcdef",
  "task_brief_ref": "tests/fixtures/task-brief.valid.json",
  "delivery_receipt_ref": "tests/fixtures/delivery-receipt.valid.json",
  "verification_report_ref": null,
  "review_report_ref": null,
  "status": "completed",
  "started_at": "2026-09-11T00:00:00Z",
  "finished_at": "2026-09-11T00:10:00Z",
  "notes": ["Synthetic fixture only; not eligible as a real pilot run."]
}
